<?xml version="1.0"  encoding="UTF-8"?>

<!ELEMENT rules (rule)+>

<!ELEMENT rule ((className|methodName),shardingExpression,shards)>

<!ELEMENT className (#PCDATA)>

<!ELEMENT methodName (#PCDATA)>

<!ELEMENT shardingExpression (#PCDATA)>

<!ELEMENT shards (#PCDATA)>
